ingredient_name;synonym_name;
ГЕКСАПЕПТИД-10; Hexapeptide-10, Аргирелин-подобный пептид
ГЕКСАПЕПТИД-11; Hexapeptide-11, Пептидный комплекс
ГЕКСИЛЕНГЛИКОЛЬ; Hexylene glycol, 2-Метил-2,4-пентандиол
ГЕКСИЛЛАУРАТ; Hexyl laurate, Гексиловый эфир лауриновой кислоты
ГЕКСИЛНИКОТИНАТ; Hexyl nicotinate, Никотинат гексила
ГЕКСИЛРЕЗОРЦИН; Hexylresorcinol, 4-Гексилрезорцин
ГЕКСИЛЦИННАМАЛ; Hexyl cinnamal, Гексилциннамальдегид
ГЕЛИОТРОПИН; Heliotropin, Пиперональ, 3,4-Метилендиоксибензальдегид
ГЕМАТИТ; Hematite, Красный железняк, Fe₂O₃
ГЕМАТИТ ЭКСТРАКТ; Hematite extract, Экстракт гематита
ГЕПТАГИДРАТ СУЛЬФАТА МАГНИЯ; Magnesium sulfate heptahydrate, Эпсомская соль, MgSO₄·7H₂O
ГЕПТАГИДРАТ СУЛЬФАТА МАГНИЯ (СОЛЬ ЭПСОМ); Epsom salt, Горькая соль, Сульфат магния
ГЕРАНИ ГИДРОЛАТ; Geranium hydrosol, Пеларгоновая вода, Pelargonium hydrosol
ГЕРАНИ ЭФИРНОЕ МАСЛО; Geranium essential oil, Масло герани, Pelargonium graveolens oil
ГЕРАНИЕВОЕ ЭФИРНОЕ МАСЛО; Geranium oil, Pelargonium graveolens oil, Масло герани
ГЕРАНИЛАЦЕТАТ; Geranyl acetate, Уксуснокислый геранил, Geraniol acetate
ГЕРАНИОЛ; Geraniol, Транс-3,7-диметил-2,6-октадиен-1-ол
ГЕРАНЬ ДИКАЯ ЭКСТРАКТ; Wild geranium extract, Geranium maculatum extract
ГЕРМАЛЬ ПЛЮС; Germall Plus, Диазолидинилмочевина, Консервант
ГЕСПЕРЕДИН; Hesperidin, Цитрусовый биофлавоноид, Витамин P
ГИАЛУРОНОВАЯ КИСЛОТА ВЫСОКОМОЛЕКУЛЯРНАЯ; High molecular hyaluronic acid, HMW HA, Натрия гиалуронат
ГИАЛУРОНОВЫЕ ФИЛЛЕРЫ; Hyaluronic fillers, ГК-филлеры, Dermal fillers
ГИАСИАЛЬ; Giasial , Гиалуроновая кислота
ГИБИСКУСА (КИТАЙСКОЙ РОЗЫ) ГИДРОЛАТ; Hibiscus hydrosol, Hibiscus rosa-sinensis hydrosol
ГИБИСКУСА СУХОЙ ЭКСТРАКТ; Hibiscus dry extract, Hibiscus sabdariffa extract
ГИДАНТОИН; Hydantoin, Гликолурил, Имидазолидин-2,4-дион
ГИДРОГЕНИЗИРОВАННОЕ МАСЛО КАНОЛЫ; Hydrogenated canola oil, Рапсовое масло гидрогенизированное
ГИДРОГЕНИЗИРОВАННОЕ РАСТИТЕЛЬНОЕ МАСЛО; Hydrogenated vegetable oil, Гидрогенизированное масло
ГИДРОГЕНИЗИРОВАННЫЕ ЭФИРЫ ОЛИВКОВОГО МАСЛА; Hydrogenated olive oil esters
ГИДРОГЕНИЗИРОВАННЫЙ ЛЕЦИТИН; Hydrogenated lecithin, Гидрогенизированный лецитин
ГИДРОГЕНИЗИРОВАННЫЙ ФОСФАТИДИЛХОЛИн; Hydrogenated phosphatidylcholine
ГИДРОГЕНИЗИРОВАННЫЙ ЭТИЛГЕКСИЛ ОЛИВАТ; Hydrogenated ethylhexyl olivate
ГИДРОЗОЛЬ ЦВЕТКОВ ЛАЙМА; Lime blossom hydrosol, Цветочная вода лайма
ГИДРОКСИАПАТИТ; Hydroxyapatite, Гидроксиапатит кальция, Ca₅(PO₄)₃(OH)
ГИДРОКСИАЦЕТОФЕНОН; Hydroxyacetophenone, 1-(4-Гидроксифенил)этанон
ГИДРОКСИД АЛЮМИНИЯ; Aluminum hydroxide, Гидроксид алюминия, Al(OH)₃
ГИДРОКСИД КАЛИЯ; Potassium hydroxide, Едкий кали, KOH
ГИДРОКСИЛИРОВАННЫЙ ЛЕЦИТИН; Hydroxylated lecithin
ГИДРОКСИМЕТИЛЦЕЛЛЮЛОЗА; Hydroxymethylcellulose, Гидроксиметилцеллюлоза
ГИДРОКСИПРОПИЛ МЕТИЛЦЕЛЛЮЛОЗА; Hydroxypropyl methylcellulose, Гипромеллоза
ГИДРОКСИПРОПИЛ ФОСФАТ КРАХМАЛА; Hydroxypropyl starch phosphate
ГИДРОКСИПРОПИЛГУАР; Hydroxypropyl guar, Гидроксипропилгуаровая камедь
ГИДРОКСИПРОПИЛКРАХМАЛ; Hydroxypropyl starch
ГИДРОКСИПРОПИЛТРИМОНИУМ ГИДРОЛИЗАТ КУКУРУЗНОГО КРАХМАЛА; Hydroxypropyltrimonium hydrolyzed corn starch
ГИДРОКСИПРОПИЛТРИМОНИУМ ГИДРОЛИЗАТ ПРОТЕИНОВ ПШЕНИЦЫ; Hydroxypropyltrimonium hydrolyzed wheat protein
ГИДРОКСИПРОПИЛЦЕЛЛЮЛОЗА; Hydroxypropylcellulose, Гидроксипропилцеллюлоза
ГИДРОКСИСТЕАРИНОВАЯ КИСЛОТА; Hydroxystearic acid, 12-гидроксистеариновая кислота
ГИДРОКСИЦИКЛОГЕКСИЛФЕНИЛКЕТОН; Hydroxycyclohexyl phenyl ketone
ГИДРОКСИЦИТРОНЕЛЛАЛЬ; Hydroxycitronellal, 7-гидроксицитронеллаль
ГИДРОКСИЭТИЛ ЭТИЛЦЕЛЛЮЛОЗА; Hydroxyethyl ethylcellulose
ГИДРОКСИЭТИЛМОЧЕВИНА; Hydroxyethyl urea, Гидроксиэтилмочевина
ГИДРОКСИЭТИЛЦЕЛЛЮЛОЗА; Hydroxyethylcellulose, Гидроксиэтилцеллюлоза
ГИДРОКСИЭТИЛЦЕТЕАРАМИДОПРОПИЛ ДИМОНИУМ ХЛОРИД; Hydroxyethylcetearylamidopropyl dimonium chloride
ГИДРОЛИЗАТ ДРОЖЖЕЙ; Hydrolyzed yeast, Гидролизованные дрожжи
ГИДРОЛИЗАТ ЗЕЛЕНОГО ГОРОШКА; Hydrolyzed green pea, Гидролизованный горох
ГИДРОЛИЗАТ КОЛЛАГЕНА; Hydrolyzed collagen, Гидролизованный коллаген
ГИДРОЛИЗАТ МОЛОКА; Hydrolyzed milk protein, Гидролизованный молочный белок
ГИДРОЛИЗАТ МОЛОЧНОЙ СЫВОРОТКИ; Hydrolyzed whey protein, Гидролизованный сывороточный белок
ГИДРОЛИЗАТ МУКОПОЛИСАХАРИДА RHIZOBIAN; Hydrolyzed Rhizobian mucopolysaccharide
ГИДРОЛИЗАТ ОВСА; Hydrolyzed oat protein, Гидролизованный овес
ГИДРОЛИЗАТ ПЛАНКТОНА; Hydrolyzed plankton, Гидролизованный планктон
ГИДРОЛИЗАТ ПОЛИСАХАРИДОВ ФЕРМЕНТИРОВАННЫЙ; Fermented polysaccharide hydrolyzate
ГИДРОЛИЗАТ ПРОТЕИНОВ БРАЗИЛЬСКОГО ОРЕХА; Hydrolyzed Brazil nut protein
ГИДРОЛИЗАТ ПРОТЕИНОВ ГОРОХА; Hydrolyzed pea protein
ГИДРОЛИЗАТ ПРОТЕИНОВ КУНЖУТА; Hydrolyzed sesame protein
ГИДРОЛИЗАТ ПРОТЕИНОВ ОВОЩЕЙ ПГ-ПРОПИЛ СИЛАНЕТРОИЛ; Hydrolyzed vegetable protein PG-propyl silanetriol
ГИДРОЛИЗАТ ПРОТЕИНОВ ПШЕНИЦЫ ПГ-ПРОПИЛСИЛАНЕТРОИЛ; Hydrolyzed wheat protein PG-propyl silanetriol
ГИДРОЛИЗАТ ПРОТЕИНОВ ПШЕНИЦЫ/ПВП КРОССПОЛИМЕР; Hydrolyzed wheat protein/PVP crosspolymer
ГИДРОЛИЗАТ ПРОТЕИНОВ РИСОВЫХ ОТРУБЕЙ; Hydrolyzed rice bran protein
ГИДРОЛИЗАТ ПРОТЕИНОВ СЕМЯН ХЛОПКА; Hydrolyzed cottonseed protein
ГИДРОЛИЗАТ РЫБНОЙ МУКИ; Hydrolyzed fish protein, Гидролизованный рыбный белок
ГИДРОЛИЗАТ СОИ; Hydrolyzed soy protein, Гидролизованный соевый белок, Soy peptide complex
ГИДРОЛИЗАТ ФАСОЛИ; Hydrolyzed bean protein, Гидролизованный белок фасоли, Phaseolus vulgaris hydrolysate
ГИДРОЛИЗАТ ШЕЛКА; Hydrolyzed silk, Silk amino acids, Гидролизованный шелк
ГИДРОЛИЗАТ ЭЛАСТИНА; Hydrolyzed elastin, Эластиновые пептиды, Гидролизованный эластин
ГИДРОЛИЗИРОВАННЫЙ ГЛЮКОЗАМИНОГЛЮКАН; Hydrolyzed glucosaminoglycan, ГАГ-гидролизат
ГИДРОЛИЗИРОВАННЫЙ КЕРАТИН; Hydrolyzed keratin, Кератиновые аминокислоты
ГИДРОЛИЗИРОВАННЫЙ ПЕКТИН; Hydrolyzed pectin, Пектиновые олигосахариды
ГИДРОЛИЗОВАННАЯ ГИАЛУРОНОВАЯ КИСЛОТА; Hydrolyzed hyaluronic acid, Низкомолекулярная ГК
ГИДРОЛИЗОВАННЫЙ ВОСК ЖОЖОБА; Hydrolyzed jojoba wax, Гидролизованный воск жожоба
ГИДРОЛИЗОВАННЫЙ ГУАР; Hydrolyzed guar gum, Гидроксипропилтримониум гуар
ГИДРОЛИЗОВАННЫЙ ДНК; Hydrolyzed DNA, Дезоксирибонуклеиновой кислоты гидролизат
ГИДРОЛИЗОВАННЫЙ КАЗЕИН; Hydrolyzed casein, Казеиновые пептиды
ГИДРОЛИЗОВАННЫЙ КУКУРУЗНЫЙ КРАХМАЛ; Hydrolyzed corn starch, Гидролизованный мальтодекстрин
ГИДРОЛИЗОВАННЫЙ РАСТИТЕЛЬНЫЙ ПРОТЕИН; Hydrolyzed vegetable protein, Гидролизованный растительный белок
ГИДРОЛИЗОВАННЫЙ РНК; Hydrolyzed RNA, Рибонуклеиновой кислоты гидролизат
ГИДРОЛИЗОВАННЫЙ СОЕВЫЙ ПРОТЕИН; Hydrolyzed soybean protein, Соевые пептиды
ГИДРОХИНОН; Hydroquinone, 1,4-дигидроксибензол, Арбутин предшественник
ГИДРОХЛОРИД ГЛЮКОЗАМИНА; Glucosamine hydrochloride, Глюкозамина гидрохлорид
ГИНКГО БИЛОБА ГИДРОЛАТ; Ginkgo biloba hydrosol, Гинкговая вода
ГИНКГО БИЛОБА ЭКСТРАКТ СЕМЯН; Ginkgo seed extract, Экстракт семян гинкго
ГИПСОФИЛА МЕТЕЛЬЧАТАЯ ЭКСТРАКТ КОРНЯ; Gypsophila paniculata root extract
ГИРОКИЭТИЛЭТИЛДИАМИНТРИУКСУСНАЯ КИСЛОТА; Hydroxyethylethylenediaminetriacetic acid, HEDTA
ГИСТИДИН; Histidine, L-гистидин, Аминокислота
ГЛИКАН; Glycan, Полисахаридный комплекс
ГЛИКОГЕН; Glycogen, Животный крахмал
ГЛИКОЛЕВАЯ КИСЛОТА; Glycolic acid, Альфа-гидроксикислота, AHA
ГЛИКОЛЬ СТЕАРАТ; Glycol stearate, Этиленгликоль моностеарат
ГЛИКОСФИНГОЛИПИДНЫЙ КОМПЛЕКС; Glycosphingolipid complex, Церамидный прекурсор
ГЛИКОСФИНГОЛИПИДЫ; Glycosphingolipids, Сфинголипиды
ГЛИНА АРМЯНСКАЯ; Armenian clay, Бентонитовая глина
ГЛИНА БЕЛАЯ; White clay, Каолин, China clay
ГЛИНА ЖЕЛТАЯ; Yellow clay, Желтая охра
ГЛИНА ЗЕЛЕНАЯ; Green clay, Иллит, Морская глина
ГЛИНА КРАСНАЯ; Red clay, Красная охра
ГЛИНА РОЗОВАЯ; Pink clay, Розовый каолин
ГЛИНА ЧЕРНАЯ; Black clay, Вулканическая глина
ГЛИНА(Ы); Clay, Минеральная глина
ГЛИОКСИЛОВАЯ КИСЛОТА; Glyoxylic acid, Оксоуксусная кислота
ГЛИЦЕРЕТ-26; Glycereth-26, ПЭГ-26 глицерин
ГЛИЦЕРЕТ-7 КОКОАТ; Glycereth-7 cocoate, Кокоглицериды
ГЛИЦЕРИДЫ РОСТКОВ ПШЕНИЦЫ; Wheat germ glycerides, Липиды зародышей пшеницы
ГЛИЦЕРИЛ ИЗОСТЕАРАТ; Glyceryl isostearate, Изостеариновый моноглицерид
ГЛИЦЕРИЛ КАПРИЛАТ; Glyceryl caprylate, Каприловый моноглицерид
ГЛИЦЕРИЛ ЛАУРАТ; Glyceryl laurate, Лауриновый моноглицерид
ГЛИЦЕРИЛ МОНООЛЕАТ (ЭСТЕР А); Glyceryl monooleate, GMO, Моноолеин
ГЛИЦЕРИЛ ОЛЕАТ PCA; Glyceryl oleate PCA, Пирролидонкарбоновый эфир глицерина и олеиновой кислоты
ГЛИЦЕРИЛ ПОЛИМЕТАКРИЛАТ; Glyceryl polymethacrylate, Липогель
ГЛИЦЕРИЛ СТЕАРАТ; Glyceryl stearate, Моностеарин, GMS
ГЛИЦЕРИЛ СТЕАРАТ SE; Glyceryl stearate SE, СамоЭмульгирующийся глицерилстеарат
ГЛИЦЕРИЛ СТЕАРАТ ЦИТРАТ; Glyceryl stearate citrate, Лимоннокислый эфир глицерилстеарата
ГЛИЦЕРИЛ УНДЕЦИЛЕНАТ; Glyceryl undecylenate, Противогрибковый эфир глицерина
ГЛИЦЕРИЛГЛЮКОЗИД; Glyceryl glucoside, Глицеросилглюкозид
ГЛИЦЕРИЛСТЕАРАТ/ПЭГ-100 СТЕАРАТ; Glyceryl stearate/PEG-100 stearate, Эмульгирующий воск
ГЛИЦЕРИН ЛИНОЛЕНАТ; Glycerin linolenate, Линоленовый эфир глицерина
ГЛИЦЕРИН РАСТИТЕЛЬНЫЙ; Vegetable glycerin, Глицерин растительного происхождения
ГЛИЦЕРИН, БЕЗВОДНЫЙ; Glycerin, anhydrous, Концентрированный глицерин
ГЛИЦЕРОФОСФАТ КАЛЬЦИЯ; Calcium glycerophosphate, Кальциевая соль глицерофосфорной кислоты
ГЛИЦИН; Glycine, Аминоуксусная кислота
ГЛИЦИРРЕТИНОВАЯ КИСЛОТА; Glycyrrhetinic acid, Эноксолон
ГЛИЦИРРИЗАТ АММОНИЯ; Ammonium glycyrrhizate, Солодки экстракт аммонийная соль
ГЛИЦИРРИЗАТ КАЛИЯ; Potassium glycyrrhizate, Солодки экстракт калиевая соль
ГЛИЦИРРИЗИН КОРНЕЙ ЛАКРИЧНИКА; Glycyrrhizin, Солодковый корень
ГЛУТАМИНОВАЯ КИСЛОТА; Glutamic acid, Глутамат, Аминокислота
ГЛУТАРАЛЬ (ГЛУТАРОВЫЙ АЛЬДЕГИД); Glutaral, Глутаровый альдегид
ГЛУТАРОВАЯ КИСЛОТА; Glutaric acid, Пентандиовая кислота
ГЛУТАТИОН; Glutathione, Глутатион, Антиоксидант
ГЛЮКАМИН; Glucamine, N-метилглюкамин
ГЛЮКОЗА; Glucose, Декстроза, Виноградный сахар
ГЛЮКОЗАМИНОГЛИКАНЫ; Glycosaminoglycans, ГАГ, Мукополисахариды
ГЛЮКОЗЫ ГЛУТАМАТ; Glucose glutamate, Глутамат глюкозы
ГЛЮКОЛИПИДАМИНЫ; Glycolipidamines, Гликолипидные амины
ГЛЮКОМАННАН; Glucomannan, Полисахарид конжака
ГЛЮКОНАТ; Gluconate, Глюконовая кислота
ГЛЮКОНОЛАКТОН; Gluconolactone, Полигидроксикислота, PHA
ГЛЮКООКСИДАЗА; Glucose oxidase, Фермент
ГЛЮКУРОНОЛАКТОН; Glucuronolactone, Глюкуроновая кислота
ГЛЮТАМИЛ АМИДОЭТИЛ ИМИДАЗОЛА; Glutamyl amidothyl imidazole, Имидазолилглутамин
ГЛЮТЕН (ПШЕНИЧНАЯ КЛЕЙКОВИНА); Gluten, Пшеничный белок
ГОДЖИ СУХОЙ ЭКСТРАКТ; Goji dry extract, Lycium barbarum extract
ГОДЖИ ЭКСТРАКТ ПЛОДОВ; Goji berry extract, Ягоды годжи экстракт
ГОЛУБАЯ АГЕРАТА ЭКСТРАКТ ЛИСТЬЕВ; Blue ageratum leaf extract, Ageratum houstonianum extract
ГОЛУБАЯ ГЛИНА; Blue clay, Морская глина
ГОЛУБИКА УЗКОЛИСТНАЯ ЭКСТРАКТ ПЛОДОВ; Blueberry extract, Vaccinium angustifolium extract
ГОМОСАЛАТ; Homosalate, Солнцезащитный фильтр
ГОРЕЦ МНОГОЦВЕТКОВЫЙ ЭКСТРАКТ КОРНЯ; Polygonum multiflorum root extract, Fo-ti extract
ГОРЕЦ ПТИЧИЙ ЭКСТРАКТ; Knotweed extract, Polygonum aviculare extract
ГОРЕЧАВКА ЖЕЛТАЯ ЭКСТРАКТ КОРНЯ; Gentian root extract, Gentiana lutea extract
ГОРЧИЦЫ МАСЛО; Mustard oil, Горчичное масло
ГОРЧИЧНЫЙ ПОРОШОК; Mustard powder, Порошок горчицы
ГОТУ КОЛЫ СУХОЙ ЭКСТРАКТ; Gotu kola dry extract, Centella asiatica extract
ГРАНАТ ЭКСТРАКТ КОЖУРЫ; Pomegranate peel extract, Punica granatum peel extract
ГРАНАТА СЕМЯН СВЕРХКРИТИЧЕСКИЙ CO2 ЭКСТРАКТ; Pomegranate seed CO2 extract, Supercritical pomegranate extract, Punica granatum seed CO2 extract
ГРАНАТОВЫХ КОСТОЧЕК МАСЛО; Pomegranate seed oil, Масло косточек граната, Punica granatum seed oil
ГРАНАТОВЫХ КОСТОЧЕК ПОРОШОК; Pomegranate seed powder, Гранатовый порошок, Punica granatum seed powder
ГРАФИТОВЫЙ ПИГМЕНТ; Graphite pigment, Графитовый краситель
ГРЕЙПФРУТА ГИДРОЛАТ; Grapefruit hydrosol, Грейпфрутовая вода, Citrus paradisi hydrosol
ГРЕЙПФРУТА СЕМЯН СУХОЙ ЭКСТРАКТ; Grapefruit seed dry extract, Citrus paradisi seed extract
ГРЕЙПФРУТА ЭФИРНОЕ МАСЛО; Grapefruit essential oil, Масло грейпфрута, Citrus paradisi oil
ГРЕЙПФРУТОВОЙ КОСТОЧКИ МАСЛЯНЫЙ ЭКСТРАКТ; Grapefruit seed oil extract, Экстракт косточек грейпфрута
ГРЕЦКИЙ ОРЕХ МАСЛО; Walnut oil, Juglans regia oil, Масло грецкого ореха
ГРЕЦКИЙ ОРЕХ ЭКСТРАКТ; Walnut extract, Экстракт грецкого ореха, Juglans extract
ГРЕЦКИЙ ОРЕХ ЭКСТРАКТ ЯДЕР; Walnut kernel extract, Экстракт ядер грецкого ореха
ГРЕЦКОГО ОРЕХА ГИДРОЛАТ; Walnut hydrosol, Ореховая вода, Juglans hydrosol
ГРЕЦКОГО ОРЕХА МАСЛО; Juglans regia oil, Walnut oil
ГРЕЦКОГО ОРЕХА ЭКСТРАКТ; Juglans regia extract, Walnut leaf extract
ГРИНДЕЛИЯ МОЩНАЯ; Grindelia robusta, Grindelia extract, Экстракт гринделии
ГРУША ОБЫКНОВЕННАЯ СОК ФРУКТОВ; Pear juice, Грушевый сок, Pyrus communis juice
ГРУШАНКИ ЛЕЖАЧЕЙ (ЗИМОЛЮБКИ) ЭФИРНОЕ МАСЛО; Wintergreen oil, Gaultheria procumbens oil
ГРУШИ ФРУКТОВАЯ ПУДРА; Pear fruit powder, Грушевый порошок, Pyrus powder
ГРЯЗЬ МЕРТВОГО МОРЯ; Dead Sea mud, Мертвоморская грязь
ГРЯЗЬ ТЕРМАЛЬНАЯ; Thermal mud, Термальная грязь
ГУАВЫ ЭКСТРАКТ; Guava extract, Psidium guajava extract
ГУАНИН; Guanine, Перламутровый пигмент
ГУАНОЗИН; Guanosine, Пуриновый нуклеозид
ГУАРАНА ЭКСТРАКТ СЕМЯН; Guarana seed extract, Paullinia cupana extract
ГУАРАНЫ ЭКСТРАКТ; Guarana extract, Экстракт гуараны
ГУАРОВАЯ КАМЕДЬ; Guar gum, Cyamopsis tetragonoloba gum
ГУАРОВАЯ КАМЕДЬ (ГУАРОВАЯ СМОЛА ИЛИ ГУАР); Guar gum, Гуаровая смола
ГУРЬЮНСКИЙ БАЛЬЗАМ ЭФИРНОЕ МАСЛО; Gurjun balsam oil, Dipterocarpus oil
ГЕНИСТЕИН; Genistein, Фитоэстроген сои
ДАМАСЦЕНОН; Damascone, Розовый ароматический компонент
ДАМИАНА СУХОЙ ЭКСТРАКТ; Damiana dry extract, Turnera diffusa extract
ДАММАНСКАЯ СМОЛА; Dammar resin, Дамарская смола
ДЕВЯСИЛА ДУШИСТОГО ЭФИРНОЕ МАСЛО; Inula graveolens oil, Эфирное масло девясила
ДЕВЯСИЛА СУХОЙ ЭКСТРАКТ; Elecampane dry extract, Inula helenium extract
ДЕГИДРОАЦЕТАТ НАТРИЯ; Sodium dehydroacetate, Консервант
ДЕГИДРОУКСУСНАЯ КИСЛОТА; Dehydroacetic acid, DHA
ДЕКАГЛИН 1-ЛВ; Decaglyn 1-LV, Полиглицерил-10 лаурат
ДЕКСТРАН; Dextran, Полисахарид
ДЕКСТРИН; Dextrin, Пиродекстрин
ДЕЛЬТА-ДЕКАЛАКТОН; delta-Decalactone, Персиковый ароматизатор
ДЕНАТУРИРОВАННЫЙ СПИРт; Denatured alcohol, Денатурат
ДЕРЕЗА КИТАЙСКАЯ ЭКСТРАКТ ПЛОДОВ; Goji berry extract, Lycium chinense extract
ДЕЦИЛГЛИКОЗИД; Decyl glucoside, Децилглюкозид
ДЕЦИЛГЛЮКОЗИД; Decyl glucoside, ПАВ
ДЕЦИЛЕНГЛИКОЛЬ; Decylene glycol, 1,2-Декандиол
ДЕЦИЛОВЫЙ АЛЬДЕГИД; Decyl aldehyde, Каприновый альдегид
ДЕЦИЛОЛЕАТ; Decyl oleate, Олеиновый эфир децила
ДИ-ППГ-2 МИРЕТ-10 АДИПАТ; Di-PPG-2 myreth-10 adipate, Эмульгатор
ДИ-ППГ-3-МИРИСТИЛ АДИПАТ; Di-PPG-3 myristyl adipate, Смягчающий агент
ДИАЗОЛИДИНИЛМОЧЕВИНА; Diazolidinyl urea, Консервант
ДИАМИНОПИРИМИДИНОКСИД; Diaminopyrimidine oxide, Активатор роста волос
ДИАТОМОВАЯ ВОДОРОСОЛЬ ЭКСТРАКТ; Diatom algae extract, Экстракт диатомей
ДИАТОМОВАЯ ЗЕМЛЯ; Diatomaceous earth, Кизельгур
ДИАЦЕТОН; diacetone, 4-hydroxy-4-methylpentan-2-one
ДИБУТИЛФТАЛАТ; dibutyl phthalate, DBP, ди-n-бутилфталат
ДИГИДРОКСИАЦЕТОН; dihydroxyacetone, DHA, глицерон
ДИГИДРОКСИМЕТИЛКРОМОН; dihydroxymethylchromone, 5,7-dihydroxy-2-methylchromone
ДИГИДРОКСИПРОПИЛ ПЭГ-5 ЛИНОЛЕАММОНИУМ ХЛОРИД; dihydroxypropyl PEG-5 linoleammonium chloride, MAQUAT SL-5
ДИГЛИЦЕРИЛСЕСКВИЗОСТЕАРАТ; diglyceryl sesquistearate, diglyceryl monosesquistearate
ДИЗОДИУМ ЛАУРОАМФОДИПРОПИНАТ; disodium lauroamphodipropionate, disodium 1-(2-(2-carboxyethoxy)ethyl)-1-(2-carboxyethyl)-4,5-dihydro-2-undecyl-1H-imidazolium hydroxide
ДИИЗОПРОПИАДИПИНАТ; diisopropyl adipate, adipic acid diisopropyl ester
ДИИЗОПРОПИЛ ДИЛИНОЛЕАТ ДИМЕР; diisopropyl dimer dilinoleate, diisopropyl dilinoleate dimer
ДИИЗОПРОПИЛСЕБАКАТ; diisopropyl sebacate, decanedioic acid diisopropyl ester
ДИИЗОСТЕАРИЛМАЛАТ; diisostearyl malate, bis(16-methylheptadecyl) 2-hydroxybutanedioate
ДИКАЛИЕВАЯ СОЛЬ ЭДТА; dipotassium EDTA, ethylenediaminetetraacetic acid dipotassium salt
ДИКАЛЬЦИЙ ФОСФАТ; dicalcium phosphate, calcium hydrogen phosphate, calcium phosphate dibasic
ДИКАПРИЛОВЫЙ КАРБОНАТ; dicaprylyl carbonate, dioctyl carbonate
ДИЛИНОЛЕВАЯ КИСЛОТА; dilinoleic acid, 9,12-octadecadienoic acid (Z,Z)-, dimer
ДИМЕКСИД; dimexide, dimethyl sulfoxide, DMSO
ДИМЕР ДИНОЛЕИЛ ДИМЕР ДИНОЛЕАТ; dimer dilinoleyl dimer dilinoleate
ДИМЕТИКОН; dimethicone, polydimethylsiloxane, PDMS
ДИМЕТИКОН PCA; dimethicone PCA
ДИМЕТИКОН КРОССПОЛИМЕР; dimethicone crosspolymer
ДИМЕТИКОН КРОССПОЛИМЕР-3; dimethicone crosspolymer-3
ДИМЕТИКОН ПЭГ-7 ФОСФАТ; dimethicone PEG-7 phosphate
ДИМЕТИКОН/ВИНИЛДИМЕТИКОН КРОССПОЛИМЕР; dimethicone/vinyl dimethicone crosspolymer
ДИМЕТИКОНОЛ; dimethiconol
ДИМЕТИЛ ИЗОСОРБИД; dimethyl isosorbide
ДИМЕТИЛАМИНОЭТАНОЛ; dimethylaminoethanol, DMAE
ДИМЕТИЛМЕТОКСИ ХРОМАНОЛ; dimethylmethoxy chromanol
ДИМЕТИЛСИЛОКСАНОВЫЙ КАУЧУК; dimethylsiloxane rubber
ДИМЕТИЛФТАЛАТ; dimethyl phthalate, DMP
ДИНАТРИЙ КАПРИЛОИЛ ГЛЮТАМАТ; disodium capryloyl glutamate
ДИНАТРИЙ ЭДТА; disodium EDTA, ethylenediaminetetraacetic acid disodium salt
ДИНАТРИЯ ЛАУРЕТ СУЛЬФОСУКЦИНАТ; disodium laureth sulfosuccinate
ДИНАТРИЯ ФОСФАТ; disodium phosphate
ДИОКСИД ТИТАНА; Titanium dioxide, TiO₂, Пигмент белый
ДИОКСИД УГЛЕВОДА; Carbon dioxide, Углекислый газ, CO₂
ДИОКСИД ЦИНКА; Zinc oxide, ZnO, Цинковые белила
ДИОКТИЛДЕСИЛ IPDI; Dioctyldecyl IPDI, Полимерный загуститель
ДИОЛЕАТ; Dioleate, Двуолеат, Эфир олеиновой кислоты
ДИОЛЕОИЛЭТИЛ ГИДРОКСИЭТИЛМОНИУМ МЕТИЛСУЛЬФАТ; Dioleoylethyl hydroxyethylmonium methosulfate, Кондиционирующий агент
ДИОСКОРЕЯ ЭКСТРАКТ; Dioscorea extract, Wild yam extract, Экстракт дикого ямса
ДИОСМИН; Diosmin, Флавоноид, Венотоник
ДИПЕНТАЭРИТРИТИЛ ГЕКСАКАПРИЛАТ/ГЕКСАКАПРАТ; Dipentaerythrityl hexacaprylate/hexacaprate, Эмолент
ДИПЕПТИД-2; Dipeptide-2, Пептидный комплекс
ДИПРОПИЛЕНГЛИКОЛЬСАЛИЦИЛАТ; Dipropylene glycol salicylate, Растворитель
